title,abstract,journal,DOI,year
[Arthroscopic management of recent or chronic lesions of triangular fibrocartilage complex of the wrist].,"Lesions of the triangular fibrocartilage complex of the wrist (TFCC) have perfectly been dismembered by Andrew Palmer and have largely benefited from progress of arthroscopy of the wrist. One distinguishes thus traumatic lesions (class 1) individualized according to their localization, central (1-A), ulnar (1-B), radial (1-D) or distal (1-C). Central lesions are classically associated to a positive ulnar variance. The clinical symptomatology evokes a meniscal like syndrome of the wrist. In case of failure of the medical treatment, it will be necessary to propose a surgical procedure guided by histopathology of the triangular complex. Thus, ulnar peripheral richly vascularized lesions (1-B) could therefore potentially heal and will have to benefit by an attempt of surgical reattachment (arthroscopic technique of Whipple, Poehling or other techniques) or by an osteosynthesis in case of fracture on the basis on the ulnar styloid process. Central fibrocartilage lesions (1-A) or radial avulsions (1-D) are less vascularized and have therefore little probability to heal; they will benefit then ideally from the endoscopic debridement of unstable flaps of the central portion of TFCC. No immobilization is required and rehabilitation is immediately undertaken. Less frequent class 1-C lesions justify in our practice a simple arthroscopic regularization, alone complete ruptures could have necessitate a direct suture. Class 2 degenerative lesions are graduated (A to E) according to evolution of the chondromalacia of the ulnar head and carpal bone, perforation of the central disc and lunotriquetral ligament degeneration. They are usually associated with a constitutional or an acquired ulnar plus variance syndrome, for example after a distal radius fracture malunion. The clinical symptomatology needs to differentiate them from the simple frequent physiological perforations after the age of 50 years. Arthroscopy will allow to regularize unstable non-vascularized lesions and to perform a wafer procedure through the large hole of the central disc. Alone lesions with very positive ulnar variance or fail of minimally invasive procedures, justify, in our experience, a shortening osteotomy of the ulna.",Chirurgie de la main,17361887,2007
[Therapeutic interest of wrist arthroscopy: about 1000 cases].,"Wrist arthroscopy is a relatively recent procedure because it was described in the 70's. During the first period of 80's it became an indisputable technique of diagnosis. Since the 90's many therapeutic procedure were described by several authors all over the world. This technique increase a lot the understanding of wrist pathologies and ameliorate significantly the results for patients. We report our experience about 1000 wrist arthroscopy between 1998 and 2005. The patients were always operated on outpatient basis under local regional anaesthesiology. The arm was laid on the table and the hand on in-line traction (5-7 kg). We used a 2.4 mm arthroscope, 30 degree angled. The both joints, radiocarpal and midcarpal, were systematically explored. The small portals were not closed. In our experience, only 42 arthroscopies (4%) were without surgical procedure. We separated the indications in 7 chapters: (1) arthoscopic assistance for fractures treatment (distal radius and scaphoid: 7%; (2) TFCC tears (17%); (3) treatment of intrinsic ligaments tears (scapholunate and lunotriquetral: 21%); (4) ectomy (radial styloidectomy, wafer, carpal boss 13%); (5) resection of wrist ganglia (21%); (6) partial prosthesis (2.5%); (7) others techniques (arthrolysis, synovectomy 14.5%).",Chirurgie de la main,17361884,2007
[Arthroscopic treatment of the ulnar impaction syndrome.],"The ulnar impaction syndrome is due to hyperpressure in the ulnocarpal joint. It occurs most frequently following distal radial fractures with shortening, but can also be secondary to a primitive length discrepancy between a short radius and a long ulna (positive ulnar variance). Symptoms and clinical findings, even though characteristic, are not specific. Standard X rays show a positive ulnar variance, and sometimes a hyperpressure cyst in the lunate. CT arthroscan and MRI studies demonstrate indirect signs of hyperpressure. If medical treatment fails to improve the condition, the choice surgical technique is arthroscopic, allowing debridement of the TFCC central tear, and shortening of the horizontal aspect of the ulnar head.",Chirurgie de la main,17349396,2007
[Arthroscopic management of recent or chronic lesions of Triangular Fibrocartilage Complex of the wrist.],"Lesions of the triangular fibrocartilage complex of the wrist (TFCC) have perfectly been dismembered by Andrew Palmer and have largely benefited from progress of arthroscopy of the wrist. One distinguishes thus traumatic lesions (class 1) individualized according to their localization, central (1-A), ulnar (1-B), radial (1-D) or distal (1-C). Central lesions are classically associated to a positive ulnar variance. The clinical symptomatology evokes a meniscal like syndrome of the wrist. In case of failure of the medical treatment, it will be necessary to propose a surgical procedure guided by histopathology of the triangular complex. Thus, ulnar peripheral richly vascularized lesions (1-B) could therefore potentially heal and will have to benefit by an attempt of surgical reattachment (arthroscopic technique of Whipple, Poehling or other techniques) or by an osteosynthesis in case of fracture on the basis on the ulnar styloid process. Central fibrocartilage lesions (1-A) or radial avulsions (1-D) are less vascularized and have therefore little probability to heal; they will benefit then ideally from the endoscopic debridement of unstable flaps of the central portion of TFCC. No immobilization is required and rehabilitation is immediately undertaken. Less frequent class 1-C lesions justify in our practice a simple arthroscopic regularization, alone complete ruptures could have necessitate a direct suture. Class 2 degenerative lesions are graduated (A to E) according to evolution of the chondromalacia of the ulnar head and carpal bone, perforation of the central disc and lunotriquetral ligament degeneration. They are usually associated with a constitutional or an acquired ulnar plus variance syndrome, for example after a distal radius fracture malunion. The clinical symptomatology needs to differentiate them from the simple frequent physiological perforations after the age of 50 years. Arthroscopy will allow to regularize unstable non-vascularized lesions and to perform a wafer procedure through the large hole of the central disc. Alone lesions with very positive ulnar variance or fail of minimally invasive procedures, justify, in our experience, a shortening osteotomy of the ulna.",Chirurgie de la main,17349392,2007
[Therapeutic interest of wrist arthroscopy about 1000 cases.],"Wrist arthroscopy is a relatively recent procedure because it was described in the 70's. During the first period of 80's it became an indisputable technique of diagnosis. Since the 90's many therapeutic procedure were described by several authors all over the world. This technique increase a lot the understanding of wrist pathologies and ameliorate significantly the results for patients. We report our experience about 1000 wrist arthroscopy between 1998 and 2005. The patients were always operated on outpatient basis under local regional anaesthesiology. The arm was laid on the table and the hand on in-line traction (5-7 kg). We used a 2.4 mm arthroscope, 30 degrees angled. The both joints, radiocarpal and midcarpal, were systematically explored. The small portals were not closed. In our experience, only 42 arthroscopies (4%) were without surgical procedure. We separated the indications in 7 chapters: 1) arthoscopic assistance for fractures treatment (distal radius and scaphoid: 7%; 2) TFCC tears (17%); 3) treatment of intrinsic ligaments tears (scapholunate and lunotriquetral: 21%); 4) ectomy (radial styloidectomy, wafer, carpal boss 13%); 5) resection of wrist ganglia (21%); 6) partial prosthesis (2,5%); 7) others techniques (arthrolysis, synovectomy 14,5%).",Chirurgie de la main,17349389,2007
"Evaluation of the triangular fibrocartilage in cadaveric wrists by means of arthrography, magnetic resonance (MR) imaging, and MR arthrography.","PURPOSE: To evaluate the diagnostic accuracy of arthrography, magnetic resonance (MR) imaging, and MR arthrography in the detection and localization of defects of the triangular fibrocartilage (TFC) in cadaveric wrists, using arthroscopy as a reference standard.MATERIAL AND METHODS: Twenty-four specimen wrists were evaluated. The different imaging modalities were blinded to reviewers and were interpreted independently. A classification of TFC defects was used for the evaluation of images in the different imaging modalities, thus permitting a more uniform correlation. Two cases were excluded from the MR imaging study because of poor image quality. Contingency tables with the chi-square test and Fisher's exact test were used for statistical analysis.RESULTS: Defects of the TFC were identified in 17 of the 24 specimen wrists by means of arthroscopy, and 16 defects were observed when arthrography was carried out. With MR imaging 14 defects of the TFC were detected in the 22 specimen wrists evaluated, and with MR arthrography 16 defects were observed. Most defects were central or combined (two or more defects). In comparison to arthroscopy, the accepted diagnostic gold standard, the following results were found for arthrography in the detection of TFC defects: sensitivity 95%, specificity 100%, and accuracy 95% (P&lt;0.0005); for MR imaging: sensitivity 86%, specificity 85%, and accuracy 70% (P&lt;0.002); and for MR arthrography: sensitivity 100%, specificity 85%, and accuracy 95% (P&lt;0.0005).CONCLUSION: The results of the study seem to indicate that both arthrography and MR arthrography have high accuracy, and either would be useful for evaluation of the TFC. The combined approach using both techniques would have a very high accuracy equivalent to that resulting from arthroscopy.","Acta radiologica (Stockholm, Sweden : 1987)",17325933,2007
Ulnar nerve palsy associated with fracture of the distal radius.,"OBJECTIVE: To describe the clinical features and outcome of a series of patients with complete motor and sensory ulnar nerve palsy associated with a fracture of the distal radius.DESIGN: Retrospective case series.SETTING: Level 1 trauma center.PARTICIPANTS: Five adults with acute complete motor and sensory ulnar nerve palsy associated with fracture of the distal radius were treated during a 2 year period. There were 3 men and 2 women, with an average age of 42 years (range, 33 to 56 years). All 5 distal radius fractures were high energy and widely displaced. Three patients had an associated ulna fracture (2 styloid, 1 styloid and distal diaphysis), and 1 had a complete triangular fibrocartilage complex (TFCC) avulsion from the distal ulna (associated with an open wound). Two patients had open fractures.INTERVENTION: Open reduction and internal fixation of the distal radius fracture in 4 patients and external fixation in 1 patient. Three patients had exploration and release of the ulnar nerve because it was associated with an acute carpal tunnel syndrome.MAIN OUTCOME MEASUREMENTS: Recovery of ulnar nerve function.RESULTS: At an average follow-up of 17 months, 4 patients had complete or near-complete recovery of ulnar nerve function. One patient had moderate motor and mild sensory dysfunction.CONCLUSIONS: Acute ulnar nerve palsy may occur in association with high-energy, widely displaced fractures of the distal radius. These are usually neurapraxic injuries that recover to normal or near-normal strength and sensation. We recommend exploration and release of a complete ulnar nerve palsy associated with a fracture of the distal radius fracture when there is an open wound or an acute carpal tunnel syndrome, and observation without exploration otherwise.",Journal of orthopaedic trauma,17304066,2007
Irreducible Galeazzi fracture-dislocation due to intra-articular fracture of the distal ulna.,Irreducible Galeazzi fracture-dislocation is a rare injury. Structures that mechanically block the reduction are usually soft tissues. We present an irreducible case due to distal ulnar intra-articular fracture.,"The Journal of hand surgery, European volume",17223233,2007
Accuracy of direct magnetic resonance arthrography in the diagnosis of triangular fibrocartilage complex tears of the wrist.,"The aim of this study was to assess the value of direct magnetic resonance (MR) arthrography of the wrist for detecting full-thickness tears of the triangular fibrocartilage complex (TFCC). Twenty-four consecutive patients who had ulnar-sided wrist pain and clinical suspicion of TFCC tear were included in the study. All patients underwent direct MR arthrography and then wrist arthroscopy, and the results of MR arthrography were compared with the arthroscopic findings. The positive predictive value of MR arthrography in detecting TFCC full-thickness tear was 0.95, and the negative predictive value was 0.50. The sensitivity of MR arthrography in detecting a TFCC full-thickness tear was 74% (15/19), and specificity was 80% (4/5). The overall accuracy of MR arthrography in detecting a full-thickness tear of the TFCC in our study was 79% (19/24). We believe that diagnosis of tears in the TFCC by direct MR arthrography is not entirely satisfactory, although MR arthrography has a high positive predictive value for detecting TFCC tears. Negative results of MR arthrography in patients with clinical suspicion of TFCC tear should be interpreted with caution.",International orthopaedics,17216523,2007
Peripheral tear of the triangular fibrocartilage: depiction with MR arthrography of the distal radioulnar joint.,"OBJECTIVE: Although central tears of the triangular fibrocartilage are easily seen on imaging, peripheral tears of the ulnar attachment are frequently missed. The aim of this study was to evaluate the accuracy of MR arthrography of the distal radioulnar joint in depiction of peripheral tears of the triangular fibrocartilage.MATERIALS AND METHODS: Forty-one patients (18 women, 23 men; mean age, 38 years; age range, 18-60 years) underwent MR arthrography and wrist arthroscopy. For MR arthrography, iopamidol (300 mg I/mL) and gadopentetate dimeglumine (4 mmol/L) were injected into the distal radioulnar joint. Consensus review of both MR arthrograms and conventional arthrograms was performed by two experienced musculoskeletal radiologists. Presence or absence of communicating and noncommunicating tears of the ulnar attachment of the triangular fibrocartilage was recorded. Arthroscopy was used as the standard of reference for determining sensitivity, specificity, and accuracy in detection of tears of the ulnar attachment.RESULTS: At MR arthrography, communicating tear of the ulnar attachment was diagnosed in three patients, noncommunicating tear in 19 patients, and normal attachment in 19 patients. Arthroscopy revealed peripheral tear of the triangular fibrocartilage in all three patients with communicating tear, in 14 of 19 patients with noncommunicating tear, and in three of 19 patients with normal attachment. The sensitivity was 85% (17/20), specificity was 76% (16/21), and accuracy was 80% (33/41).CONCLUSION: MR arthrography of the distal radioulnar joint is accurate in depiction of peripheral tears of the ulnar attachment of the triangular fibrocartilage. These tears often appear as noncommunicating tears extending from the distal radioulnar joint into the triangular fibrocartilage.",AJR. American journal of roentgenology,17179363,2006
Triangular fibrocartilage complex tears: a review.,"Triangular fibrocartilage complex (TFCC) tears are a common source of ulnar sided wrist pain. Originally described by Palmer, in 1981, as a complex of several structures, our understanding of the anatomy and the function of the TFCC has been refined by histologic studies. The TFCC plays an important role in load bearing across the wrist as well as in distal radioulnar joint (DRUJ) stabilization. A thorough knowledge of the anatomy as well as the Palmer classification system helps to guide treatment options.",Bulletin of the NYU hospital for joint diseases,17155920,2006
[Intraarticular distal radius fractures--arthroscopic assessment of injuries].,"Intraarticular distal radius fractures affect predominantly young people by contrary to &quot;loco typico&quot; fractures concerning old patients with osteoporosis. They are usually caused by high energy trauma and their treatment needs anatomic reposition. Between August and December 2004 there were performed 10 wrist arthroscopies in distal intraarticular radius fractures: 3 women and 7 men, age from 20 to 63 years, average 41. In all cases arthroscopy revealed larger displacement than assessed by standard radiographs and multiple associated soft tissue injuries were detected: lesions of TFCC in 5 patients, cartilage lesions of carpal bones in 6 and I degree SL interosseous ligament lesion in 4 patients. Arthroscopy in distal radius fractures allows detailed articular surface displacement assessment and reposition under &quot;eye control&quot;. Additionally associated soft tissue injuries, which are not visible in standard X-ray examination are detected and treated.",Chirurgia narzadow ruchu i ortopedia polska,17133833,2006
Arthroscopic management of distal radius fractures.,"Arthroscopy has the advantage of providing a direct and accurate assessment of the articular surfaces and detecting the presence of injuries associated with distal radius fractures. Current indications, although numerous and potentially expanding, also are controversial. This report presents a global view of the current status of arthroscopy in the management of distal radius fractures. The rationale of arthroscopic treatment, the available evidence, and finally the diagnosis and treatment are discussed.",The Journal of hand surgery,17095385,2006
Comparison between high-resolution MRI with a microscopy coil and arthroscopy in triangular fibrocartilage complex injury.,"PURPOSE: To determine whether high-resolution magnetic resonance imaging (MRI) could detect injuries to the triangular fibrocartilage complex (TFCC).METHODS: Eleven patients who showed both a positive sign during the ulnocarpal stress test and tenderness at the distal end of the ulna had a high-resolution MRI using a 47-mm diameter microscopy coil. Six regions of the TFCC were investigated for injury: the radial attachment, disc, ulnar attachment of the triangular fibrocartilage (TFC), ulnotriquetral ligament, palmar radioulnar ligament (PRUL), and dorsal radioulnar ligament (DRUL). Arthroscopy was performed subsequently on each patient.RESULTS: For injuries to the radial attachment or the disc of the TFC, a high-resolution MRI showed 100% sensitivity and 100% specificity compared with arthroscopy. In 3 cases in which injury to the ulnar attachment of the TFC was detected with MRI and examination showed a positive piano-key sign and distal radioulnar joint instability, only 1 injury was confirmed with arthrotomy. For MRI diagnosis of an ulnotriquetral ulnolunate attachment injury, the sensitivity was 100% and the specificity was 70%; however, 3 cases had false-positive results. Finally MRI had 100% sensitivity for detecting DRUL and PRUL injuries, although specificities were 75% and 83%, respectively. With MRI there were 2 false-positive DRUL injury diagnoses and 1 false-positive PRUL injury diagnosis.CONCLUSIONS: High-resolution MRI using a microscopy surface coil allowed assessment of each TFCC component and showed a higher accuracy for diagnosing injuries to the radial attachment and the disc of the TFC compared with previous studies. High-resolution MRI, however, was not able to diagnose DRUL, PRUL, or ulnolunate ligament injuries accurately.LEVEL OF EVIDENCE: Diagnostic III.",The Journal of hand surgery,17027792,2006
Arthroscopic repair of peripheral triangular fibrocartilage complex tears with suture welding: a technical report.,This report presents a method of arthroscopic repair of the peripheral triangular fibrocartilage complex tears that replaces traditional suture knots with ultrasonic welding of sutures. This will help eliminate potential causes of ulnar-sided wrist discomfort during the postoperative period.,The Journal of hand surgery,17027791,2006
Role of MR imaging in chronic wrist pain.,"Magnetic resonance (MR) imaging for chronic wrist pain is challenging. Correct assessment of the triangular fibrocartilage, hyaline cartilage, ligaments, and tendons has become mandatory for comprehensive decision making in wrist surgery. The MR technique, potential and limits of MR imaging in patients with chronic wrist pain will be discussed. MR arthrography with injection of gadolinium-containing contrast material into the distal radioulnar joint is suggested for evaluation of the triangular fibrocartilage. The clinically meaningful ulnar-sided peripheral tears are otherwise hard to diagnose. The diagnostic performance of MR imaging for interosseous ligament tears varies considerably. The sensitivity for scapholunate ligament tears is consistently better than for lunotriquetral ligament tears. Gadolinium-enhanced MR imaging is considered to be the best technique for detecting established avascularity of bone, but the assessment of the MR results remains challenging. Most cases of ulnar impaction syndrome have characteristic focal signal intensity changes in the ulnar aspect of the lunate. Avascular necrosis of the lunate (Kienböck's disease) is characterized by signal changes starting in the proximal radial aspect of the lunate. MR imaging is extremely sensitive for occult fractures. Questions arise if occult posttraumatic bone lesions seen on MR images only necessarily require the same treatment as fractures evident on plain films or computed tomography (CT) images. MR imaging and ultrasound are equally effective for detecting occult carpal ganglia. Carpe bossu (carpal boss) is a bony protuberance of a carpometacarpal joint II and III which may be associated with pain.",European radiology,16932876,2006
MR imaging of ligaments and triangular fibrocartilage complex of the wrist.,"Imaging of the wrist with MR imaging can be difficult because of the small size of this joint, its complex anatomy, and its sometimes poorly understood pathologic lesions. A recent study by Hobby and coworkers of 98 patients revealed that MR imaging of the wrist influences clinicians' diagnoses and management plans in most patients. This article summarizes the current diagnostic criteria that can be useful in interpreting abnormalities of the wrist ligaments and triangular fibrocartilage complex (TFCC) of the wrist in this difficult topic in joint MR imaging.",Radiologic clinics of North America,16829252,2006
Injury of the dorsal sensory branch of the ulnar nerve as a complication of arthroscopic repair of the triangular fibrocartilage.,"This report presents a case of direct injury to the dorsal sensory branch of the ulnar nerve caused by arthroscopic repair of the triangular fibrocartilage complex. The dorsal sensory branch of the ulnar nerve was strangulated by one of the three pull-out sutures of the joint capsule, just ulnar to the extensor carpi ulnaris tendon. Pain and dysaesthesia of the ulnar side of the wrist was completely relieved after excision of the injured nerve segment. This complication can be avoided by careful exploration of the dorsal sensory branch of the ulnar nerve prior to suturing or passage of instruments during arthroscopy.","Journal of hand surgery (Edinburgh, Scotland)",16777280,2006
Uses and abuses of wrist arthroscopy.,"PURPOSE OF REVIEW: The use of wrist arthroscopy in the diagnosis and treatment of carpal pathology continues to expand. The purpose of this paper is to summarize recent advances in the utility of this diagnostic, therapeutic, and research tool.RECENT FINDINGS: The indications for wrist arthroscopy are growing with the description of volar portals for the radiocarpal and scaphotrapezial trapezoid joint. Arthroscopic assistance in the treatment of distal radius and scaphoid fractures is also becoming more feasible. Arthroscopic excision of dorsal carpal ganglions has met with considerable success. In addition, the application of electrothermal collagen shrinkage is an exciting new frontier in arthroscopic wrist procedures.SUMMARY: Wrist arthroscopy has evolved to be an essential diagnostic and therapeutic tool in the armamentarium of every surgeon treating disorders of the wrist.",Techniques in hand &amp; upper extremity surgery,16628118,2006
