title,abstract,journal,DOI,year
Surgical treatment of acute distal radioulnar joint instability associated with distal radius fractures.,"This study investigates the question of whether open repair of acute distal radioulnar joint instability at the time of volar plating of distal radius fractures would enable early mobilization of the wrist without the risk of distal radioulnar joint instability. We evaluated 29 patients of mean age 53 years with a distal radius fracture and acute distal radioulnar joint instability who underwent volar plating of the radius combined with surgical repair of the triangular fibrocartilage complex or an ulnar styloid base fracture, followed by active motion exercise of the wrist at 1 week after surgery. At 1 year after treatment, all patients had a stable distal radioulnar joint and grip strength averaged 90% of the normal side. This study demonstrates that surgical repair of the triangular fibrocartilage complex or ulnar styloid fracture followed by early mobilization did not result in distal radioulnar joint instability, and suggests that the surgical treatment of distal radioulnar joint instability may permit early mobilization of the wrist in patients who are considered suitable for rapid rehabilitation after surgery. Type of study: Therapeutic Level IV.","The Journal of hand surgery, European volume",26037650,2015
Immunohistochemical Mapping of Sensory Nerve Endings in the Human Triangular Fibrocartilage Complex.,"BACKGROUND: The triangular fibrocartilage complex is the main stabilizer of the distal radioulnar joint. While static joint stability is constituted by osseous and ligamentous integrity, the dynamic aspects of joint stability chiefly concern proprioceptive control of the compressive and directional muscular forces acting on the joint. Therefore, an investigation of the pattern and types of sensory nerve endings gives more insight in dynamic distal radioulnar joint stability.PURPOSES: We aimed to (1) analyze the general distribution of sensory nerve endings and blood vessels; (2) examine interstructural distribution of sensory nerve endings and blood vessels; (3) compare the number and types of mechanoreceptors in each part; and (4) analyze intrastructural distribution of nerve endings at different tissue depth.METHODS: The subsheath of the extensor carpi ulnaris tendon sheath, the ulnocarpal meniscoid, the articular disc, the dorsal and volar radioulnar ligaments, and the ulnolunate and ulnotriquetral ligaments were dissected from 11 human cadaver wrists. Sensory nerve endings were counted in five levels per specimen as total cell amount/cm(2) after staining with low-affinity neurotrophin receptor p75, protein gene product 9.5, and S-100 protein and thereafter classified according to Freeman and Wyke.RESULTS: All types of sensory corpuscles were found in the various structures of the triangular fibrocartilage complex with the exception of the ulnolunate ligament, which contained only Golgi-like endings, free nerve endings, and unclassifiable corpuscles. The articular disc had only free nerve endings. Furthermore, free nerve endings were the predominant sensory nerve ending (median, 72.6/cm(2); range, 0-469.4/cm(2)) and more prevalent than all other types of mechanoreceptors: Ruffini (median, 0; range, 0-5.6/cm(2); difference of medians, 72.6; p &lt; 0.001), Pacini (median, 0; range, 0-3.8/cm(2); difference of medians, 72.6; p &lt; 0.001), Golgi-like (median, 0; range, 0-2.1/cm(2); difference of medians, 72.6; p &lt; 0.001), and unclassifiable corpuscles (median, 0; range, 0-2.5/cm(2); difference of medians, 72.6; p &lt; 0.001). The articular disc contained fewer free nerve endings (median, 1.8; range, 0-17.8/cm(2)) and fewer blood vessels (median, 29.8; range, 0-112.2/cm(2); difference of medians: 255.9) than all other structures of the triangular fibrocartilage complex (p ≤ 0.001, respectively) except the ulnolunate ligament. More blood vessels were seen in the volar radioulnar ligament (median, 363.62; range, 117.8-871.8/cm(2)) compared with the ulnolunate ligament (median, 107.7; range, 15.9-410.3/cm(2); difference of medians: 255.91; p = 0.002) and the dorsal radioulnar ligament (median, 116.2; range, 53.9-185.1/cm(2); difference of medians: 247.47; p = 0.001). Free nerve endings were obtained in each structure more often than all other types of sensory nerve endings (p &lt; 0.001, respectively). The intrastructural analysis revealed no differences in mechanoreceptor distribution in all investigated specimens with the numbers available, showing a homogenous distribution of proprioceptive qualities in all seven parts of the triangular fibrocartilage complex.CONCLUSIONS: Nociception has a primary proprioceptive role in the neuromuscular stability of the distal radioulnar joint. The articular disc and ulnolunate ligament rarely are innervated, which implies mainly mechanical functions, whereas all other structures have pronounced proprioceptive qualities, prerequisite for dynamic joint stability.CLINICAL RELEVANCE: Lesions of the volar and dorsal radioulnar ligaments have immense consequences not only for mechanical but also for dynamic stability of the distal radioulnar joint, and surgical reconstruction in instances of radioulnar ligament injury is important.",Clinical orthopaedics and related research,26024577,2015
[Ulnar-sided wrist pain in sports: TFCC lesions and fractures of the hook of the hamate bone as uncommon diagnosis].,"Injuries to the hand and wrist are common sports injuries. The diagnosis and therapy of wrist injuries are becoming more important, especially in increasingly more popular ball-hitting sports, such as golf, tennis and baseball. Ulnar-sided wrist pain is initially often misdiagnosed and treated as tenosynovitis or tendinitis but tears of the triangular fibrocartilage complex (TFCC) and fractures of the hook of hamate bone, which can also occur in these sports are seldomly diagnosed. The aim of this study was to conduct a systematic review of the literature focussing on TFCC lesions and fractures of the hook of the hamate bone in racquet sports, baseball and golf. A systematic review of the literature was performed in PubMed on the occurrence of TFCC lesions and fractures of the hook of the hamate bone. All studies and case reports were included. Because of the rarity of these injuries there were no exclusion criteria concerning the number of cases. Injuries associated with ball-hitting sports, such as TFCC lesions and fractures of hook of the hamate bone are still underrepresented in the current literature on sports injuries. The diagnosis and treatment of these injuries are often delayed and can severely handicap the performance and career of affected professional as well as amateur athletes. ",Der Unfallchirurg,25956726,2015
Arthroscopic Knotless Peripheral Ulnar-Sided TFCC Repair.,"This article describes the indications and technique for all-arthroscopic knotless repair of a peripheral tear to the triangular fibrocartilage complex (TFCC). The advantage of this technique is that it allows repair of the articular disk back to the fovea of the ulna without any suture knots to irritate the patient. The learning curve is steep, but once learned, this technique can be performed very quickly and is faster. There are no knots to irritate the patient, and in the author's opinion, there is quicker pain relief than with other techniques. ",Journal of wrist surgery,25945301,2015
The Dorsal Triangular Fibrocartilage of the Metacarpophalangeal Joint: A Cadaveric Study.,"PURPOSE: To describe a fibrocartilaginous structure on the dorsal surface of the metacarpophalangeal (MCP) joint.METHODS: A combination of anatomical dissection, histology, ultrasound, and magnetic resonance imaging was undertaken to explore the anatomical structure described, with clinical correlation undertaken by surgical exploration of MCP joints.RESULTS: A dorsal structure of the MCP joint was identified as fibrocartilagenous in composition, triangular in shape, and-together with the volar plate and collateral and accessory collateral ligaments-forming a deepened dorsal fossa in which the metacarpal head invaginated. It was attached to the extensor tendon by loose connective tissue and formed part of the joint capsule.CONCLUSIONS: The dorsal fibrocartilage of the MCP joint is a constant anatomical structure that appears to complement the structural support for the metacarpal head and extensor tendon. Possible functions include stabilization of the extensor tendon, formation of a dorsal fossa, prevention of extensor tendon attrition, and synovial fluid production. Its structure and function may have implications in future development of joint replacement devices.CLINICAL RELEVANCE: This study adds to the collective knowledge about the precise anatomy of the MCP joint. Reconstructive surgery and, in particular, joint replacement surgery should consider the potential function and importance of this structure when designing interventions on the joint.",The Journal of hand surgery,25944552,2015
Effect of volar angulation of extra-articular distal radius fractures on distal radioulnar joint stability: a biomechanical study.,"The relationship between increased volar tilt of the distal radius and distal radioulnar joint stability was examined. Distal radioulnar joint stiffness was recorded at 10° intervals from 10° dorsal angulation to 20° of volar angulation from the anatomical position of the radius. Tests were performed with the intact radioulnar ligament and repeated after partial and then complete sectioning of the radioulnar ligament at the ulnar fovea. With the intact radioulnar ligament, distal radioulnar joint stiffness increased significantly at 10° and 20° of volar angulation. Partial sectioning of the radioulnar ligament resulted in an approximate 10% decrease of distal radioulnar joint stiffness compared with the intact state, but distal radioulnar joint stiffness still increased significantly with greater volar tilt. Complete sectioning of the radioulnar ligament significantly decreased distal radioulnar joint stiffness, and increasing the volar tilt did not result in increased distal radioulnar joint stiffness. These results suggest that volar angulation deformities of the distal radius should be corrected to 10° of volar tilt when the triangular fibrocartilage complex is intact. Level of evidence: N/A.","The Journal of hand surgery, European volume",25940500,2015
The Function of the Distal Interosseous Membrane and its Relevance to the Stability of the Distal Radioulnar Joint: An Anatomical and Biomechanical Review.,"The purpose of this article is to review functional anatomy and biomechanics of the distal interosseous membrane (DIOM) and its relevance to the stability of the distal radioulnar joint. The intact DIOM constrained dorsal dislocation of the radius, but it seldom constrained palmar dislocation. A residual ulnar translation deformity of the radial shaft in distal radius fractures has the potential to cause the distal radioulnar joint instability when the triangular fibrocartilage complex injury is also present, because it may result in detensioning of DIOM. Ulnar shortening with the osteotomy performed proximal to the attachment of the DIOM had a more favorable effect on stability of the DRUJ compared with the effect of distal osteotomy, especially in the presence of the distal oblique bundle (DOB). The longitudinal resistance to ulnar shortening was significantly greater in proximal shortening than in distal shortening. ","Handchirurgie, Mikrochirurgie, plastische Chirurgie : Organ der Deutschsprachigen Arbeitsgemeinschaft fur Handchirurgie : Organ der Deutschsprachigen Arbeitsgemeinschaft fur Mikrochirurgie der Peripheren Nerven und Gefasse : Organ der V...",25938817,2015
Clinical experience with arthroscopically-assisted repair of peripheral triangular fibrocartilage complex tears in adolescents--technique and results.,"PURPOSE: The purpose of this study was to report our preliminary results after arthroscopically-assisted repair of peripheral triangular fibrocartilage complex (TFCC) tears in adolescent patients.METHODS: All children and adolescents who underwent arthroscopically-assisted repair of a Palmer 1B tear were identified and prospectively evaluated after a mean follow-up of 1.3 years. The postoperative assessment included documentation of clinical parameters, pain score (visual analogue scale, VAS), grip strength and completion of validated outcome scores (Modified Mayo Wrist Score, MMWS; Disabilities of the Arm, Shoulder and Hand Inventory, DASH). A total of 12 patients (four males, eight females) with a mean age of 16.3 years at the time of surgery were evaluated.RESULTS: The mean VAS decreased significantly from 7.0 to 1.7 after the procedure. We observed a significant increase of the MMWS after surgery; however, MMWS was still significantly lower at final follow-up when compared to the contralateral side. A mean postoperative DASH score of 16 indicated an excellent outcome after the procedure. DASH Sports and Work Modules showed fair and good overall outcomes in the short-term, respectively. Grip strength averaged 86 % of the contralateral side at final follow-up, with no significant difference being found between both sides.CONCLUSIONS: Arthroscopically-assisted repair of peripheral TFCC tears in adolescents provided predictable pain relief and markedly improved functional outcome scores. Concomitant pathologies may have to be addressed at the same time to eventually achieve a satisfactory outcome. Sports participation, however, may be compromised in the short-term and should therefore be resumed six months postoperatively.",International orthopaedics,25916955,2015
Total Flavonoids from Clinopodium chinense (Benth.) O. Ktze Protect against Doxorubicin-Induced Cardiotoxicity In Vitro and In Vivo.,"Doxorubicin has cardiotoxic effects that limit its clinical benefit in cancer patients. This study aims to investigate the protective effects of the total flavonoids from Clinopodium chinense (Benth.) O. Ktze (TFCC) against doxorubicin- (DOX-) induced cardiotoxicity. Male rats were intraperitoneally injected with a single dose of DOX (3 mg/kg) every 2 days for three injections. Heart samples were collected 2 weeks after the last DOX dose and then analyzed. DOX delayed body and heart growth and caused cardiac tissue injury, oxidative stress, apoptotic damage, mitochondrial dysfunction, and Bcl-2 expression disturbance. Similar experiments in H9C2 cardiomyocytes showed that doxorubicin reduced cell viability, increased ROS generation and DNA fragmentation, disrupted mitochondrial membrane potential, and induced apoptotic cell death. However, TFCC pretreatment suppressed all of these adverse effects of doxorubicin. Signal transduction studies indicated that TFCC suppressed DOX-induced overexpression of p53 and phosphorylation of JNK, p38, and ERK. Studies with LY294002 (a PI3K/AKT inhibitor) demonstrated that the mechanism of TFCC-induced cardioprotection also involves activation of PI3K/AKT. These findings indicated the potential clinical application of TFCC in preventing DOX-induced cardiac oxidative stress. ",Evidence-based complementary and alternative medicine : eCAM,25784945,2015
Arthroscopic foveal repair of the triangular fibrocartilage complex.,"Background Foveal disruption of the triangular fibrocartilage complex (TFCC) is associated with distal radioulnar joint (DRUJ) instability. TFCC fixation onto the fovea is the suitable treatment, which is not achieved by conventional arthroscopic techniques. We describe an all-inside arthroscopic technique that uses a suture anchor through distal DRUJ arthroscopy for foveal repair of the TFCC. Materials and Methods Forty-eight patients with TFCC foveal tear and DRUJ instability were selected according to the Atzei-European Wrist Arthroscopy Society (EWAS) algorithm of treatment. Retrospective evaluation included pain, DRUJ instability, range of motion (ROM), grip strength, Modified Mayo Wrist Score (MMWS), and the Disabilities of the Arm, Shoulder, and Hand (DASH) Score. Description of Technique DRUJ arthroscopy was performed to débride the TFCC and the foveal area. Under arthroscopic guidance, a suture anchor was inserted via the distal foveal portal to repair the TFCC onto the fovea. Sutures were tied on the radiocarpal surface of the TFCC. Postoperative immobilization of forearm rotation was maintained for 4 weeks. Heavy tasks were allowed after 3 months. Results After a mean follow-up of 33 months, pain improved significantly but remained moderate in four patients, severe in one. DRUJ instability resolved in 44 patients. Wrist ROM increased. Grip strength, MMWS, and DASH score improved significantly. Excellent and good MMWS equaled 83.3%. Forty-one patients (85.5%) resumed previous work and sport activities. As a postoperative complication, five patients experienced neuroapraxia of the dorsal sensory branch of the ulnar nerve (DSBUN) with full spontaneous recovery. Conclusions With appropriate indications and patient selection, arthroscopic foveal repair of the TFCC may restore DRUJ stability and provide satisfactory results without significant complications. ",Journal of wrist surgery,25709875,2015
Anatomical Reattachment of the TFCC to the Ulnar Fovea Using an ECU Half-Slip.,"Background Since 1998, we treated 25 wrists with foveal detachment of the triangular fibrocartilage complex (TFCC) by our original reattachment technique using a half-slip of the extensor carpi ulnaris (ECU) tendon with a very small titanium interference screw. We examine the clinical outcome of this procedure with a minimum of 2 years follow-up. Patients and Methods There were 25 wrists of 24 patients (16 right, 7 left, 1 bilateral, mean age, 34.8 years) with a minimum follow-up of 2 years (range 2-7 years, average 3.1). There was a neutral ulnar variance in 19 wrists and positive in 6. In the positive-variance wrists, an ulnar shortening was performed to prevent ulnar abutment before the reattachment. The diagnosis of a TFCC injury was done by arthrogram, magnetic resonance imaging (MRI), and distal radioulnar (DRUJ) arthroscopy. The clinical outcome was evaluated using our original DRUJ evaluating system. Technique A distally based ECU half-slip was harvested, introduced into the TFCC, sutured to the remnant of the TFCC, and pulled out through a 2.5-mm bone tunnel at the center of the fovea. The ECU half-slip was subsequently anchored to the ulnar fovea with a small titanium interference screw. Results At the final follow-up, 21 wrists had no pain, 3 wrists indicated mild pain, and 1 wrist severe pain. One patient had a loss of supination by 30 degrees. The DRUJ was stable in 22 wrists, moderately unstable in 2 wrists, and severely unstable in 1 wrist. There were 21 excellent, 2 good, 1 fair, and 1 poor results. Conclusions Anatomic reattachment of the TFCC to the ulnar fovea using an ECU half-slip tendon is a promising procedure. This technique is effective for severe DRUJ instability due to chronic foveal avulsion of the TFCC. ",Journal of wrist surgery,25709874,2015
Reconstruction of Chronic Foveal TFCC Tears with an Autologous Tendon Graft.,"Background A triangular fibrocartilage complex (TFCC) injury can produce distal radioulnar joint (DRUJ) instability. If the foveal attachment is avulsed, it translates distally. The footprint is separated from its origin and will become covered in synovitis, preventing healing. The authors describe a surgical technique for the treatment of instability of the DRUJ due to chronic foveal detachment of the TFCC. Technique The procedure utilizes a loop of autologous palmaris longus tendon graft passed through the ulnar aspect of the TFCC and through an osseous tunnel in the distal ulna to reconstruct the fovel attachment. Patients and Methods We report on nine patients with a mean age of 42. Median follow-up was 13 months. Results The median pain scores measured were reduced from 8 to 3 postoperatively, and all had a stable DRUJ. Conclusions This technique provides stability of the distal ulna to the radius and carpus, with potential for biologic healing through osseous integration. It is a robust, anatomically based reconstruction of the TFCC to the fovea that stabilizes the DRUJ and the ulnar-carpal sag. ",Journal of wrist surgery,25709873,2015
Open repair of the triangular fibrocartilage complex from palmar aspect.,"Background Although foveal tears of the triangular fibrocartilage complex (TFCC) can be surgically reattached to the fovea via a dorsal approach, the foveal lesion is difficult to visualize from the dorsal side because the extensor carpi ulnaris (ECU) sheath floor and the superficial dorsal limb of the radioulnar ligament hinders the view of the fovea. Materials and Methods Twenty-one patients with foveal tears were treated by an open repair method from the palmar aspect. Pain, instability, motion, and grip strength were evaluated after a mean follow-up period of 26 months, and each patient was rated according to the Mayo Modified Wrist Score (MMWS). Description of Technique A 4-cm skin incision is made on the palmar aspect of the ulnar fovea. The ulnar fovea is exposed through a transverse capsulotomy of the distal radioulnar joint. The distal aspect of the TFCC is also exposed between the ECU tendon sheath and the ulnotriquetral ligament. After curettage of the scar tissue in the fovea, the deep palmar and dorsal limbs of the TFCC are sutured back to the fovea using a suture anchor technique. Results Foveal TFCC tears could be repaired via a palmar surgical approach without violating the floor of the ECU tendon sheath and the superficial dorsal limb. Excellent results were achieved in 18 patients, and a good result was achieved in three. Conclusions Our result compared favorably with those reported for dorsal approach. The palmar surgical approach facilitates the inspection and repair of the TFCC foveal tears. Level of Evidence IV. ",Journal of wrist surgery,25709872,2015
Arthroscopic knotless anchor repair of triangular fibrocartilage in distal radius fracture.,"INTRODUCTION AND OBJECTIVE: Lesions of triangular fibrocartilage (TFC) are associated with distal radioulnar joint instability. Arthroscopic treatment of these lesions improves functional outcome of affected patients. The aim of the present work is to evaluate functional and occupational outcome of TCF repair using an arthroscopic knotless anchor device in patients with associated distal radius fracture.MATERIAL AND METHODS: An observational, descriptive study was carried out between November 2011 and January 2014 including 21 patients with distal radius fracture and Palmer 1B lesions of TCF (Atzei class 2 and 3) that were treated by arthroscopic knotless anchor (PopLok® 2,8mm, ConMed, USA). Mean follow-up was 18 months. Functional (Mayo Wrist Score) and occupational outcome results were analyzed. Mean age of the group was 43.0±8.8 years, with 19% of the patients being female. There was an associated scapholunate lesion in 5 cases.RESULTS: Functional results reached a mean of 83.4±16.1 points onMayo Wrist Score. Mean sick-leave time was 153.16±48.5 days. Complete occupational reintegration was reached in 89.5% of cases. There were no postoperative complications.CONCLUSIONS: Arthroscopic knotless anchor repair of 1B TFC tears is a minimally invasive method of treatment that improves tension of fixation, avoiding subsequent loosen, in our experience, with few complications and good functional and occupational results.",Revista espanola de cirugia ortopedica y traumatologia,25659917,2015
