title,abstract,journal,DOI,year
Arthroscopic debridement of intercarpal ligament and triangular fibrocartilage complex tears.,"INTRODUCTION: Wrist arthroscopy has evolved since its inception to become an essential diagnostic and therapeutic tool for the management of various wrist disorders. Our study aimed to examine the outcomes of arthroscopic debridement in the treatment of scapholunate (SL), lunotriquetral (LT) and triangular fibrocartilage complex (TFCC) tears.METHODS: We conducted a retrospective review of 68 consecutive wrist arthroscopies performed at our institution between January 2000 and July 2005. All the patients complained of wrist pain, which often interfered with their daily activities, work or sports. A standard arthroscopic technique was employed in all. Any intercarpal ligament or TFCC tears found were debrided.RESULTS: There were 42 patients with TFCC tears, 58 with SL tears and 49 with LT tears. At a mean follow-up time of 16.6 months, 85.3% of the patients reported an improvement in symptoms and 27.9% had improved range of motion. Grip strength improved by 11.8%. All except two patients returned to their original activities. Outcome following arthroscopic debridement was determined using the Mayo Modified Wrist Score. Based on the postoperative wrist scores of 47 patients, 24 were rated excellent, 17 good, four fair and two poor. By comparing the pre- and postoperative wrist scores of 31 patients, we were able to demonstrate significant improvement in patients who underwent wrist arthroscopies.CONCLUSION: Our study demonstrated that there is a definite role for arthroscopic debridement in the management of SL, LT and TFCC tears.",Singapore medical journal,22434293,2012
Patterns of triangular fibrocartilage complex (TFCC) injury associated with severely dorsally displaced extra-articular distal radius fractures.,"PURPOSE: The aim of the study was to examine triangular fibrocartilage (TFCC) injury patterns associated with unstable, extra-articular dorsally displaced distal radius fractures.METHODS: Twenty adult patients with an Arbeitsgemeinschaft für Osteosynthesefragen (AO), type A2 or A3, distal radius fracture with an initial dorsal angulation greater than 20° were included. Nine had a tip fracture (distal to the base) of the ulnar styloid and 11 had no such fracture. They were all openly explored from an ulnopalmar approach and TFCC injuries were documented. Eleven patients also underwent arthroscopy and intra-articular pathology was recorded.RESULTS: All patients had TFCC lesions of varying severity, having an extensor carpi ulnaris subsheath avulsion in common. Eighteen out of 20 also displayed deep foveal radioulnar ligament lesions, with decreasingly dorsal fibres remaining. The extent of this foveal injury could not be appreciated by radiocarpal arthroscopy.CONCLUSIONS: Severe displacement of an extra-articular radius fracture suggests an ulnar-sided ligament injury to the TFCC. The observed lesions concur with findings in a previous cadaver study. The lesions follow a distinct pattern affecting both radioulnar as well as ulnocarpal stabilisers.",Injury,22424702,2012
[Clinical retrospective evaluation of the arthroscopic treatments of the triangular fibrocartilage complex of the wrist].,"OBJECTIVES: The aim of this study is the retrospective clinical evaluation of the arthroscopic treatments for triangular fibrocartilage complex tears.METHODS: Between 2003 and 2010, 76 patients with a traumatic lesion (Palmer type 1) and 25 patients with a degenerative lesion (Palmer type 2) of the triangular fibrocartilage complex underwent wrist arthroscopy. Clinical evaluations were based on the Mayo Modified Wrist Score (MMWS), on a compared measurement of the grip force and on a measurement of the different ranges of motion. We also made a subjective evaluation of the benefit brought by arthroscopy and a retrospective evaluation of the pre and postoperative pain.RESULTS: Mean MMWS was 86.3 for traumatic lesions and 83 for degenerative lesions. Mean grip force was 84.8 (Palmer type 1) and 84.2 (Palmer type 2) compared to the controlateral side. Mean ranges of flexion-extension, prosupination and radioulnar motions were 135°, 164° and 56° respectively for traumatic lesions and 130°, 156° and 54° respectively for degenerative lesions. Ninety-four percent of the operated patients reported an improvement of the symptomatology with better results for type 1 (98.7%) compared to type 2 (80%). We noted a clear diminution of the postoperative pain compared to the preoperative's one with frequently some mild persistent pain however.CONCLUSIONS: Arthroscopic treatments of the triangular fibrocartilage complex seem to be effective with an improvement of the symptomatology.",Chirurgie de la main,22381264,2012
Arthroscopic treatment of peripheral triangular fibrocartilage complex tears with the deep fibers intact.,"PURPOSE: We describe a variant of triangular fibrocartilage complex (TFCC) tears in which the superficial fibers attaching to the ulnar capsule are torn, with preservation of deep fibers inserting on the fovea. We present the clinical and magnetic resonance imaging findings and the results of arthroscopic repair in patients with this injury.METHODS: Twenty-nine wrists were treated arthroscopically for peripheral TFCC tears with outside-in suture repair of the TFCC to the ulnar capsule. A retrospective review of all cases was performed to assess the physical examination, magnetic resonance imaging, and intraoperative findings. Patients were evaluated at greater than 1 year with range of motion, grip strength, standard outcome measures, and a survey assessing return to work and sports.RESULTS: Before surgery, all patients had complaints of ulnar-sided wrist pain with a stable distal radioulnar joint on examination. Twenty-six wrists (90%) were available for follow-up at a mean of 31 months. There was one repeat surgery, a re-tear that required revision TFCC repair. The preoperative visual analog scale and Disabilities of the Arm, Shoulder, and Hand scores improved from 5 and 38 to 1 and 9, respectively, at final follow-up. Side-to-side comparisons demonstrated no measurable loss in motion or grip strength. There were no cases of distal radioulnar joint instability at final follow-up. Of 11 high-level athletes in the total cohort, 7 (64%) were able to return to sports, including all of those in racquet sports; however, athletes who bore weight through their hands were unable to return to their sporting activity.CONCLUSIONS: Tears of the TFCC superficial fibers with the deep fibers intact present with ulnar-sided wrist pain but without distal radioulnar joint instability. The results of outside-in repair of the articular disk back to the ulnar capsule demonstrated improvement in pain and function with no measurable objective losses. Return to sport was variable and appeared worse for those who bear weight through the hands.",The Journal of hand surgery,22305741,2012
Arthroscopic knotless peripheral triangular fibrocartilage repair.,"Peripheral tears to the articular disk of the triangular fibrocartilage complex are fairly common. Patients complain of ulnar-sided wrist pain with ulnar deviation and forearmrotation along the prestyloid recess. The peripheral tears of the articular disk are amenable to arthroscopic repair due to its blood supply. All-arthroscopic knotless repair of peripheral ulnar-sided tears of the articular disk has several advantages. This technique allows for repair of the superficial and deep layers of the articular disk directly down to bone. In addition, by being knotless, it avoids irritation to the surrounding soft tissues by suture knots. This article describes arthroscopic repair of peripheral ulnar-sided tears of the articular disk down to bone with a knotless technique.",The Journal of hand surgery,22281170,2012
Intrafocal pin plate fixation of distal ulna fractures associated with distal radius fractures.,"Subcapital ulnar fractures in association with distal radius fractures in elderly patients increase instability and pose a treatment challenge. Fixation of the ulnar fracture with traditional implants is difficult due to the subcutaneous location, comminution, and osteoporosis. We describe an intrafocal pin plate that provides fixation by a locking plate on the distal ulna and intramedullary fixation within the shaft. The low profile and percutaneous technique make this device a useful alternative for treatment of subcapital ulna fractures in the elderly.",The Journal of hand surgery,22192166,2011
Wrist arthroscopy in children and adolescents: a single surgeon experience of thirty-four cases.,"PURPOSE: The purpose of this study was to report our experience of wrist arthroscopy in children and adolescents with chronic wrist pain in a retrospective single surgeon series. Therefore, technical differences or obstacles compared to standard wrist arthroscopy in adults, and complications were highlighted.METHODS: A retrospective data review of all patients undergoing wrist arthroscopy between 2002 and 2011 was performed. The basic inclusion criteria was chronic, therapy refractory wrist pain for more than three months in children and adolescents aged 18 years and younger. In total, 34 arthroscopies in 27 girls and six boys were reviewed. The mean age at time of arthroscopic exploration was 14.6 years (range, 9.8-17.9 years).RESULTS: A total of 28 wrists showed a triangular fibrocartilage complex (TFCC) tear (82.4%). In 26 of 34 (76.5%) inspected wrist joints additional pathologies besides TFCC tears were documented. As a consequence, 14 arthroscopic TFCC resections, two arthroscopic TFCC repairs and seven open resection arthroplasties were performed. Other concomitant procedures (e.g., ulna shortening) were performed in 25 patients (26 wrists) because of predisposing malformations. No intraoperative or postoperative complications related to the arthroscopies were observed. No relevant technical differences to wrist arthroscopy in adults were experienced apart from cases of major anatomical malformations.CONCLUSIONS: Wrist arthroscopy has been shown to be a safe procedure to detect and treat paediatric wrist disorders. Nevertheless, we believe that this procedure should only be carried out by well-trained, experienced hand surgeons.",International orthopaedics,22159549,2011
Prevalence of triangular fibrocartilage complex abnormalities on MRI scans of asymptomatic wrists.,"PURPOSE: Magnetic resonance imaging (MRI) of the wrist is increasingly used in the diagnosis of ulnar-sided wrist pain; however, its efficacy in this setting still needs clarification. The purposes of this study were to investigate the prevalence of abnormal MRI findings in the triangular fibrocartilage complex (TFCC) in asymptomatic volunteers and to provide the clinician with comparative data when interpreting MRI results.METHODS: A total of 103 asymptomatic volunteers underwent imaging of the wrist using a 1.9-T MR scanner and a send-receive birdcage quadrature coil. The images were evaluated by 3 independent interpreters, 2 musculoskeletal radiologists, and 1 orthopedic hand surgeon. We noted details regarding the TFCC morphology and the presence, characteristics, and location of any TFCC abnormality.RESULTS: The TFCC was considered abnormal in 39 wrists. The scans were abnormal in 31 subjects younger than 50 years of age, in 5 subjects 50 to 59 years of age, and in all subjects older than 60 years of age (3 subjects). We diagnosed a complete tear of the TFCC in 23 wrists. An increase in age was correlated with an abnormal TFCC (r(pb) = 0.23; P = .016).CONCLUSIONS: The prevalence of incidental TFCC findings in MRI scans of asymptomatic subjects is high. The presence of an abnormal TFCC on MRI may be of questionable clinical meaning, because there is a high incidence of TFCC abnormalities in asymptomatic subjects, particularly those over the age of 50. Imaging results must be viewed in the context of the clinical history and physical examination.LEVEL OF EVIDENCE: Diagnostic III.",The Journal of hand surgery,22129657,2011
Provocative wrist tests and MRI are of limited diagnostic value for suspected wrist ligament injuries: a cross-sectional study.,"QUESTION: What is the diagnostic value of provocative wrist tests and magnetic resonance imaging (MRI) for suspected wrist ligament injuries?DESIGN: Cross-sectional study.PARTICIPANTS: 105 people presenting to hand clinics with wrist pain and suspected wrist ligament injuries were evaluated prospectively.OUTCOME MEASURES: The integrity of wrist ligaments was tested with seven provocative tests. The results were compared to the reference standard of arthroscopy. In a subgroup of 55 participants, MRI findings were also compared to arthroscopy. The provocative tests were the scaphoid shift test (SS test), lunotriquetral test (LT test), midcarpal test (MC test), distal radioulnar joint test (DRUJ test), triangular fibrocartilage complex (TFCC) stress test (TFCC test), TFCC stress test with compression (TFCC comp test), and the gripping rotatory impaction test (GRIT).RESULTS: Most provocative tests and MRI findings were of little or no value for diagnosing wrist ligament injuries. Exceptions were the SS test (+ve LR 2.88 and -ve LR 0.28), MC test (+ve LR 2.67) and DRUJ test (-ve LR 0.30), all of which were of mild diagnostic usefulness. MRI was moderately useful for diagnosing TFCC injuries (+ve LR 5.56, -ve LR 0.15), and was mildly useful for diagnosing scapholunate (SL) ligament injuries (+ve LR 4.17, -ve LR 0.32) and lunate cartilage damage (+ve LR 3.67, -ve LR 0.33). Adding MRI to provocative tests improved the accuracy of diagnosis of TFCC injuries slightly (by 13%) and lunate cartilage damage (by 8%).CONCLUSION: Provocative wrist tests of SL ligament injuries and midcarpal ligament injuries are mildly useful for diagnosing wrist injuries. MRI diagnostic findings of SL ligament injuries, lunate cartilage damage, and TFCC are mildly to moderately useful. MRI slightly improves the diagnosis of TFCC injury and lunate cartilage damage compared to provocative tests alone.",Journal of physiotherapy,22093123,2011
Persistent ulnar-sided wrist pain after treatment of triquetral dorsal chip fracture: six cases related to triangular fibrocartilage complex injury.,"INTRODUCTION: Persistent ulnar-sided wrist pain after treatment of triquetral dorsal chip fracture even after union is a matter of concern. There could be various reasons for this persistent pain like arthritis, instability, fractures and non-union. We correlate our findings of physical examination and wrist arthroscopy as triangular fibrocartilage complex injury to be one of the causes of this persistent pain.PATIENTS: Six subjects who had persistent ulnocarpal joint pain and tenderness after triquetral dorsal chip fracture, despite 2 months of conservative treatment, were subjected to physical tests. If the physical examination yields positive results, then magnetic resonance imaging followed by arthroscopic treatment was performed. The six patients were then evaluated using the visual analogue scale, the Mayo modified wrist score, and the grip strength test.RESULTS: Triangular fibrocartilage complex (TFCC) injury was observed in all six cases and partial TFCC resection and synovectomy were performed. Analysis of the visual analogue scale, Mayo modified wrist score, and grip strength test data revealed statistically significant improvements (P &lt; 0.05).CONCLUSION: In addition to several causes reported in the published literature, TFCC injury can be a cause of persistent ulnar pain after treatment of triquetral dorsal chip fracture. Arthroscopic partial TFCC resection can be considered to be a suitable treatment for such cases.",Archives of orthopaedic and trauma surgery,22072191,2011
Cone-beam computed tomography arthrography: an innovative modality for the evaluation of wrist ligament and cartilage injuries.,"PURPOSE: Cone-beam computed tomography (CBCT) has become an important modality in dento-facial imaging but remains poorly used in the exploration of the musculoskeletal system. The purpose of this study was to prospectively evaluate the performance and radiation exposure of CBCT arthrography in the evaluation of ligament and cartilage injuries in cadaveric wrists, with gross pathology findings as the standard of reference.MATERIALS AND METHODS: Conventional arthrography was performed under fluoroscopic guidance on 10 cadaveric wrists, followed by MDCT acquisition and CBCT acquisition. CBCT arthrography and MDCT arthrography images were independently analyzed by two musculoskeletal radiologists working independently and then in consensus. The following items were observed: scapholunate and lunotriquetral ligaments, triangular fibrocartilage complex (TFCC) (tear, integrity), and proximal carpal row cartilage (chondral tears). Wrists were dissected and served as the standard of reference for comparisons. Interobserver agreement, sensitivity, specificity, and accuracy were determined. Radiation dose (CTDI) of both modalities was recorded.RESULTS: CBCT arthrography provides equivalent results to MDCT arthrography in the evaluation of ligaments and cartilage with sensitivity and specificity between 82 and 100%, and interobserver agreement between 0.83 and 0.97. However, radiation dose was significantly lower (p &lt; 0.05) for CBCT arthrography than for MDCT arthrography with a mean CTDI of 2.1 mGy (range 1.7-2.2) versus a mean of 15.1 mGy (range 14.7-16.1).CONCLUSION: CBCT arthrography appears to be an innovative alternative to MDCT arthrography of the wrist as it allows an accurate and low radiation dose evaluation of ligaments and cartilage.",Skeletal radiology,22064983,2011
Subluxation of the distal radioulnar joint as a predictor of foveal triangular fibrocartilage complex tears.,"PURPOSE: The triangular fibrocartilage complex (TFCC) with its ulnar foveal attachment is the primary stabilizer of the distal radioulnar joint (DRUJ). The purpose of this study was to describe a technique for measuring the degree of subluxation of the DRUJ in wrist magnetic resonance imaging (MRI) examinations to predict tears involving the foveal attachment of the TFCC.METHODS: We measured DRUJ geometry in wrist MRI examinations of 34 patients who were found to have foveal TFCC tears at surgery. We compared the results with DRUJ geometry in 11 asymptomatic controls. Subluxation of the ulnar head was assessed using transaxial MRI images obtained at the level of the DRUJ with the wrist in pronation. We quantified subluxation with a line spanning the sigmoid notch of the radius and a perpendicular line through the center of curvature of the articulating surface of the ulna. We calculated the ratio of the lengths of the dorsal and volar segments and normalized it to the center of the sigmoid notch.RESULTS: A total of 34 patients with intraoperatively confirmed tears of the foveal attachment of the TFCC had a mean dorsal ulnar subluxation measurement of 16% ± 4%, whereas the 11 controls had a mean subluxation measurement of 5% ± 4%.CONCLUSIONS: The results confirm the hypothesis that subluxation of the ulnar head relative to the sigmoid notch of the radius, as assessed by MRI with the wrist in pronation, is a predictor of tears of the foveal attachment of the TFCC.LEVEL OF EVIDENCE: Diagnostic II.",The Journal of hand surgery,22036278,2011
Predictors of distal radioulnar joint instability in distal radius fractures.,"PURPOSE: A tear of the triangular fibrocartilage complex (TFCC) is the most frequent soft tissue injury associated with fractures of the distal radius, and repair of the deep ligamentous portion of the TFCC is considered when the tear contributes to instability of the distal radioulnar joint (DRUJ). The purpose of this prospective cohort study was to identify predictors of DRUJ instability accompanying unstable distal radius fractures.METHODS: Between 2002 and 2007, we prospectively treated 163 consecutive patients with unstable distal radius fractures with the volar locking plating system. Complete radioulnar ligament tears representing DRUJ instability were present in 11 of 163 distal radius fractures. We tested univariate associations between DRUJ instability and potential predictors and conducted multivariate analysis to establish independent predictors of instability. We applied receiver operating characteristics curves within the significant risk factors to determine threshold values.RESULTS: In univariate analyses, only the radial and sagittal translation ratios of the fracture site were significant predictors of DRUJ instability. Multivariate logistic regression analysis confirmed that the radial translation ratio, which corresponds to a normalized DRUJ gap, was a significant risk factor. According to the receiver operating characteristics curve for the radial translation ratio, the area under the curve was 0.89. A cutoff value of 15% for the radial translation ratio showed the highest diagnostic accuracy rate.CONCLUSIONS: A radiographic finding of a normalized DRUJ gap on posteroanterior views was the most important predictor to identify DRUJ instability accompanying unstable distal radius fractures. The relative risk of instability increases by 50% when the ratio of DRUJ widening increases by 1%.",The Journal of hand surgery,22036131,2011
[Chronic ulnar wrist pain in adults: diagnosis and treatment principles].,"Adult patients with chronic ulnar wrist pain often seek medical advice. There are a number of diagnoses for chronic ulnar-sided wrist pain. A sound diagnostic strategy is therefore of paramount importance. Patient's history, clinical examination and high quality standard radiographs are the most important part of this strategy. Sophisticated investigations should only be performed to focus on solid clinical hypotheses. The palmar and dorsal aetiologies of ulnar wrist pain are considered as well as their treatment principles.",Chirurgie de la main,22030264,2011
[Arthroscopic treatment for post-traumatic chronic wrist pain].,"OBJECTIVE: To explore the therapeutic effects of arthroscopy for post-traumatic chronic wrist pain.METHODS: From February 2007 to June 2010, 12 patients with post-traumatic chronic wrist pain treated with arthroscopy were reviewed. Among the patients, 9 patients were male and 3 patients were female, ranging in age from 19 to 47 years, with a mean of 35.6 years. After physical examinations or MR abnormal findings, all the patients underwent wrist arthroscopic examination and treatment. Eight patients with tear in the central area of the triangular fibrocartilage complex (TFCC) underwent endoscopic partial resection. Two patients with relaxation of inter-carpal ligament after injury underwent radiofrequency shrinkage. One patient with distal radioulnar joint instability was treated with Kirschner fixation through distal radius and ulna in the neutral forearm rotation after clean-up of wrist joint, and also fixed with long arm cast immobilization for 6 weeks. One patient with ulnar impaction syndrome was treated with wrist clean, border modeling of triangular cartilage plate, partial resection of distal ulna.RESULTS: All the patients were followed up with an average duration of 10 months. Modified Mayo wrist score were evaluated from preoperative mean of (51.67 +/- 15.27) ( 25 to 75 scores) to postoperative mean of (77.92 +/- 10.54) (65 to 95 scores). Eleven patients recovered to normal work.CONCLUSION: Arthroscopy is an effective method for patients with post-traumatic chronic wrist pain which can diagnosis and cure the injuries under arthroscopy.",Zhongguo gu shang = China journal of orthopaedics and traumatology,22007577,2011
Galeazzi fracture.,"Galeazzi fracture is a fracture of the radial diaphysis with disruption at the distal radioulnar joint (DRUJ). Typically, the mechanism of injury is forceful axial loading and torsion of the forearm. Diagnosis is established on radiographic evaluation. Underdiagnosis is common because disruption of the ligamentous restraints of the DRUJ may be overlooked. Nonsurgical management with anatomic reduction and immobilization in a long-arm cast has been successful in children. In adults, nonsurgical treatment typically fails because of deforming forces acting on the distal radius and DRUJ. Open reduction and internal fixation is the preferred surgical option. Anatomic reduction and rigid fixation should be followed by intraoperative assessment of the DRUJ. Further intraoperative interventions are based on the reducibility and postreduction stability of the DRUJ. Misdiagnosis or inadequate management of Galeazzi fracture may result in disabling complications, such as DRUJ instability, malunion, limited forearm range of motion, chronic wrist pain, and osteoarthritis.",The Journal of the American Academy of Orthopaedic Surgeons,21980027,2011
Bucket-handle tear of the triangular fibrocartilage complex: case report of a complex peripheral injury with separation of the distal radioulnar ligaments from the articular disc.,"Palmer previously proposed a classification system of triangular fibrocartilage complex (TFCC) injuries that proved to be useful in directing clinical management. However, dorsal peripheral tears (variants of class 1C) were not described and have rarely been reported in the literature since. We herewith present a rare case of bucket-handle tear of the TFCC. To our knowledge, this is the first case demonstrating partial separation of both the palmar and dorsal distal radioulnar ligaments (DRULs) from the articular disc. The particular wrist magnetic resonance (MR) arthrographic findings of this unusual complex peripheral TFCC tear (a variant of both class 1B and 1C) were nicely appreciated upon sagittal reformatted images.",Skeletal radiology,21922201,2011
